{
  "version": 2,
  "enforcement": "block",
  "blockBotAuthors": true,
  "blockedAuthors": [],
  "allowedAuthors": [],
  "scanPrBody": true,
  "scanReviewBody": true,
  "scanCommentBody": true,
  "maxAiScore": 0.9,
  "disclosureTag": "[AI-ASSISTED]",
  "disclosureRequiredScore": 0.95,
  "runtime": {
    "failOnUnsupportedEvent": true,
    "failOnMalformedPayload": true,
    "maxBodyChars": 12000,
    "maxTargets": 25,
    "maxEventBytes": 1000000
  },
  "report": {
    "includeBodies": false,
    "redactionMode": "hash"
  },
  "approvals": {
    "minHumanApprovals": 1,
    "fetchTimeoutMs": 1000,
    "maxPages": 2,
    "retry": {
      "enabled": true,
      "maxAttempts": 2,
      "baseDelayMs": 10,
      "maxDelayMs": 20,
      "jitterRatio": 0,
      "retryableStatusCodes": [429, 500, 502, 503, 504]
    }
  },
  "rules": [
    {
      "name": "explicit-ai-disclaimer",
      "pattern": "as an ai language model",
      "action": "block"
    }
  ]
}
